{"payload_sha256":"8781a31dfdb83ef5578184063dfc756c29558ab110237d9b63736bd49eb359bd","role":"core-root","schema":"repository-harness-signature-envelope/v1","sequence":1,"signatures":[{"algorithm":"ed25519","key_id":"ed25519-sha256:3f65151be3f0ac5685f3ddde86e2409579c93446ce4b4621b0922cb9ce84769f","signature":"o/orMo+iKH0IWeYclSanO6XExKM0Pjo1bXE8XjpeLsXfq3Ix3mfE0IlVH818mxWdN760f+Yc6hwf8sWaKpaICw=="},{"algorithm":"ed25519","key_id":"ed25519-sha256:597d7916a5b7ad469cd3688f5501a5d4414b82297fb13661e3d4ceaa86046440","signature":"5CdsKj4hKCtVR7VEkPslg9G8iH52PdIzap7MrWsiWuJbtV2jdIV19Wa2afVfK06xs2zpoD7z7n5sDc6OznqDDQ=="}],"trust_domain":"repository-harness-core"}