{"payload_sha256":"2a48aa4ee218681e2bbbdcc3305ffe9685b01a596c0e1f49f6cffa73bbfa9984","role":"core-root","schema":"repository-harness-signature-envelope/v1","sequence":2,"signatures":[{"algorithm":"ed25519","key_id":"ed25519-sha256:3f65151be3f0ac5685f3ddde86e2409579c93446ce4b4621b0922cb9ce84769f","signature":"eRQJyJAN+kyEWnc6WPTS82GRABPofBwaxoU7zwM9LZ3uQ1zODJRh4IS8LRIHLcXidfs+LzK7agCjN6NeSMNfCg=="},{"algorithm":"ed25519","key_id":"ed25519-sha256:597d7916a5b7ad469cd3688f5501a5d4414b82297fb13661e3d4ceaa86046440","signature":"gxCrh0MA8YjUElUDqFIPkoXwlc4QMOtsQ2SNZGzHVECriVXUi+uKz54CZWPNrU6+Y6MMMLPMyMr5R0loThX0AQ=="}],"trust_domain":"repository-harness-core"}