{"payload_sha256":"0e2f88897e5c18ce8b1515a0c6de2f6bcfac97994fac3320965afd51ef1ddcdb","role":"core-release","schema":"repository-harness-signature-envelope/v1","sequence":44,"signatures":[{"algorithm":"ed25519","key_id":"ed25519-sha256:feecf73dfe80f7c662b79bbfa20b22c27933682fa20ce8e3e5fd71575b472da3","signature":"vY6cfNFuCUNsPxX/bscaBsUxkXaIXw6mYJ5acoQ+OFO4ZaSNXWs+iHHECGvhm1HuhfDBgQQArVy6ZZdcPG9vBw=="},{"algorithm":"ed25519","key_id":"ed25519-sha256:b6783de9e9b0066da06619f47027c984b1ac710963c719cc5ec518edefe09ea9","signature":"wW/of1z/0XgJpBDD8j9GoeIEurbAWWimiz06p79D8jgjpc3DNqI9Se7IiAafJtuQNW4zscwtOCR2VjGs5WRgBw=="}],"trust_domain":"repository-harness-core"}