{"payload_sha256":"b1889382a9cf435c011254c7922b25318298ce22e7c659f458773a31da16d6d9","role":"core-root","schema":"repository-harness-signature-envelope/v1","sequence":1,"signatures":[{"algorithm":"ed25519","key_id":"ed25519-sha256:3f65151be3f0ac5685f3ddde86e2409579c93446ce4b4621b0922cb9ce84769f","signature":"HhnALcqk9qSYhdUzs0tMHOXkBbRq5wNS6CSOMG0Lb+aHvxoM20KsRllPsQtYp17U2NRWbtrNEVkShE5icmoXBQ=="},{"algorithm":"ed25519","key_id":"ed25519-sha256:597d7916a5b7ad469cd3688f5501a5d4414b82297fb13661e3d4ceaa86046440","signature":"7U16rExrM75g9cD77cM2s2MwHebmdRhOCAfXmn1cH34MfY0ag2jUBtwe7AMkK4ry1addc1gfJCQZunGdD1W2Bw=="}],"trust_domain":"repository-harness-core"}