{"payload_sha256":"500671020a6a2bbfa7e037770b19947cf63644c728906302a0a847bca49cc580","role":"core-root-rotation","schema":"repository-harness-signature-envelope/v1","sequence":3,"signatures":[{"algorithm":"ed25519","key_id":"ed25519-sha256:3f65151be3f0ac5685f3ddde86e2409579c93446ce4b4621b0922cb9ce84769f","signature":"m4eY5f9BWckVpI1rN5XGjOr+wxDxGv1/m/p9CntxSijRxFaJhJ77IEYRbEDv/yaK9ZThsSPJy8jKMiU0mLS1Cw=="},{"algorithm":"ed25519","key_id":"ed25519-sha256:597d7916a5b7ad469cd3688f5501a5d4414b82297fb13661e3d4ceaa86046440","signature":"ishcXsZsP3SPBYoud4gb3r8HWca77uxa2N677aGft7XUrtBQuy9lLuxfmsxmn0AruqQJ8VsI8q9gEjnGWPhQAw=="},{"algorithm":"ed25519","key_id":"ed25519-sha256:fd12522ce9dc8e79af3a74f6ee1a857c0c85049e889a219aaf69bbec63a10d55","signature":"Dg0pQvVoxmQELm4D25KWTMm69tLB7qfsi8eOvqLGkdEj0iv/aYWqi+K74GrUi/e1skT4sDjEzcMTwsvWMa4YCg=="},{"algorithm":"ed25519","key_id":"ed25519-sha256:c490aec5a15abb8afe50224c3331603c349011da93b2984b22a9d950fb97cbb0","signature":"QTx0ROWb0S2ibTCajIFBBRla+wOQlDBKRvvxcClEeO4PrDs33hfl/b4zJ/TqIRUc6+uH3FYQfOgkbQWzPggVDg=="}],"trust_domain":"repository-harness-core"}