{"payload_sha256":"e07d5777f0f3403fdfc5688588df0a6af37e14aeb66217e15ea2f639a83fac0f","role":"bridge-root","schema":"repository-harness-signature-envelope/v1","sequence":1,"signatures":[{"algorithm":"ed25519","key_id":"ed25519-sha256:2989b6c60c55faae775bfe8b2c961a341f59a5d651e5cd3a697cd0c4ca07b04a","signature":"ilM9pyoV3KcUuoVwqs/pO0nTzVfWZdcUeYiMAcjEhezytfrDM+nzrFZM1Cd+j6dCNKKtaAYhtwNbfeqJtiQsDw=="},{"algorithm":"ed25519","key_id":"ed25519-sha256:722e94d784c5c3277f2fa46c11f58f9a5f9309f6911600cd5292d2ab5fc8f94b","signature":"eOSrTTP85RlpRY0hj3E8K8I1eeXRHs0p9cHpXwb1RDuX3+S7jsKn/qkOXaayur5zxEqVABwa1ql4WLNuZTkLCg=="}],"trust_domain":"repository-harness-bridge"}