{"payload_sha256":"9f069a5fb2f4bcf4d8520d005de298ba62678ccc6b25905983641cec032af281","role":"core-release","schema":"repository-harness-signature-envelope/v1","sequence":43,"signatures":[{"algorithm":"ed25519","key_id":"ed25519-sha256:b6783de9e9b0066da06619f47027c984b1ac710963c719cc5ec518edefe09ea9","signature":"7eJORDJ3ohwmw6UhCNaUtqJWPY718atZMlZv/0C9XXot7Gi+eAmj9mZtTQOsXEj+mtevVIh6SFERE10w9e4PAQ=="},{"algorithm":"ed25519","key_id":"ed25519-sha256:a82211116fe8a94f72d2e81aefdbe636c99529b466ec0b4ea55c915d682a9990","signature":"kaTJRdVDvcjEbW6eoGTiMrXov7KLHk8S0leyTJuMwUVmBxWC53na/nU4DlEFzPC96YvdFnLXDWBWkrAOg3kyAw=="}],"trust_domain":"repository-harness-core"}