{"payload_sha256":"e9d9a603a14add5f2adedb6ec86f33f96a8b18182df5077e05b292cf2cb4f98c","role":"bridge-release","schema":"repository-harness-signature-envelope/v1","sequence":7,"signatures":[{"algorithm":"ed25519","key_id":"ed25519-sha256:682158d37d985dc3abb2f3964b988ca827bcca69a7d3a812b1821fe6309b95b9","signature":"1enNa2/wbVvXSMLXNLtr75Wf8V/kKkiA0ERS7QOiroB+g9AjjCdken69aK+NNHTixnb8V8r8A/3VuoRjPbJ0Dw=="},{"algorithm":"ed25519","key_id":"ed25519-sha256:d5c34b3aab6d1c09dd926597bb928a1509ef47eae22d8fe22d058720cf3dd4de","signature":"W9qPrcRxk0PzPyBnVPQuFEoRirYbNzua4C/+jwf0fHT5okjaIIX0Qq7gEpf1Mr5DypjMvDBgta2ddnGS4F1vDg=="}],"trust_domain":"repository-harness-bridge"}