{"payload_sha256":"79e530233e76eff66313137aa99b2db2ea5c0d530ac0348a7672d61f957dcc8b","role":"bridge-release","schema":"repository-harness-signature-envelope/v1","sequence":8,"signatures":[{"algorithm":"ed25519","key_id":"ed25519-sha256:682158d37d985dc3abb2f3964b988ca827bcca69a7d3a812b1821fe6309b95b9","signature":"t0vMLBqb0K0Ud/OaEBp0QBti8uh+zzCl1AC/l6qDWH4AcqCmBiT3g903xf7/wAsVZKIoDbd+mjhFlmiMunq9DA=="},{"algorithm":"ed25519","key_id":"ed25519-sha256:d5c34b3aab6d1c09dd926597bb928a1509ef47eae22d8fe22d058720cf3dd4de","signature":"xsk8FWGhUgOmq0oAHFh6rCPss8SUVnQV1X3CpAssOjK2GN0tNyGBBhDm7bZibibdOAIeIXZtHILw9pRj+VtiDQ=="}],"trust_domain":"repository-harness-bridge"}